{
  "schemaVersion": 1,
  "authority": {
    "description": "Build-time operational contract registry. It is not imported by Edge Function runtime code.",
    "evidenceDate": "2026-08-13",
    "sourceAudits": [
      "docs/edge-function-audits/phase-10-cross-function-reconciliation.md"
    ],
    "maintainerGuide": "docs/edge-function-remediation/EDGE_FUNCTION_REGISTRY_MAINTENANCE.md"
  },
  "expectedCounts": {
    "localFunctions": 105,
    "uiCalled": 82,
    "nonUiCalled": 23,
    "retired": 13
  },
  "profiles": {
    "ui_authority": {
      "lifecycle": "active",
      "caller": "ui",
      "allowedMethods": [
        "POST",
        "OPTIONS"
      ],
      "authMode": "staff_jwt",
      "allowedStaffRoles": [
        "admin",
        "account_manager"
      ],
      "clientScope": "required",
      "jwtVerification": "verified",
      "alternateSecret": null,
      "serviceRoleUsage": true,
      "deployable": true,
      "operationalOwner": "Cockpit engineering",
      "requiredEnvironment": [
        "SUPABASE_URL",
        "SUPABASE_SERVICE_ROLE_KEY"
      ]
    },
    "ui_operational": {
      "lifecycle": "active",
      "caller": "ui",
      "allowedMethods": [
        "POST",
        "OPTIONS"
      ],
      "authMode": "staff_jwt",
      "allowedStaffRoles": [
        "admin",
        "account_manager",
        "editor"
      ],
      "clientScope": "required",
      "jwtVerification": "verified",
      "alternateSecret": null,
      "serviceRoleUsage": true,
      "deployable": true,
      "operationalOwner": "Cockpit engineering",
      "requiredEnvironment": [
        "SUPABASE_URL",
        "SUPABASE_SERVICE_ROLE_KEY"
      ]
    },
    "ui_held": {
      "lifecycle": "held",
      "caller": "ui",
      "allowedMethods": [
        "POST",
        "OPTIONS"
      ],
      "authMode": "staff_jwt",
      "allowedStaffRoles": [
        "admin",
        "account_manager",
        "editor"
      ],
      "clientScope": "required",
      "jwtVerification": "verified",
      "alternateSecret": null,
      "serviceRoleUsage": true,
      "deployable": false,
      "operationalOwner": "Cockpit engineering",
      "requiredEnvironment": [
        "SUPABASE_URL",
        "SUPABASE_SERVICE_ROLE_KEY"
      ]
    },
    "operator_internal": {
      "lifecycle": "internal",
      "caller": "operator",
      "allowedMethods": [
        "POST",
        "OPTIONS"
      ],
      "authMode": "staff_jwt",
      "allowedStaffRoles": [
        "admin",
        "account_manager"
      ],
      "clientScope": "required",
      "jwtVerification": "verified",
      "alternateSecret": null,
      "serviceRoleUsage": true,
      "deployable": true,
      "operationalOwner": "Cockpit engineering",
      "requiredEnvironment": [
        "SUPABASE_URL",
        "SUPABASE_SERVICE_ROLE_KEY"
      ]
    },
    "function_internal": {
      "lifecycle": "internal",
      "caller": "internal_function",
      "allowedMethods": [
        "POST",
        "OPTIONS"
      ],
      "authMode": "forwarded_staff_jwt",
      "allowedStaffRoles": [
        "admin",
        "account_manager",
        "editor"
      ],
      "clientScope": "required",
      "jwtVerification": "verified",
      "alternateSecret": null,
      "serviceRoleUsage": true,
      "deployable": true,
      "operationalOwner": "Cockpit engineering",
      "requiredEnvironment": [
        "SUPABASE_URL",
        "SUPABASE_SERVICE_ROLE_KEY"
      ]
    },
    "cron_jwt_disabled": {
      "lifecycle": "background",
      "caller": "cron",
      "allowedMethods": [
        "POST",
        "OPTIONS"
      ],
      "authMode": "cron_secret",
      "allowedStaffRoles": [],
      "clientScope": "derived",
      "jwtVerification": "disabled_with_alternate_auth",
      "alternateSecret": "CRON_SECRET",
      "serviceRoleUsage": true,
      "deployable": true,
      "operationalOwner": "Cockpit engineering",
      "requiredEnvironment": [
        "SUPABASE_URL",
        "SUPABASE_SERVICE_ROLE_KEY",
        "CRON_SECRET"
      ]
    },
    "cron_jwt_verified": {
      "lifecycle": "background",
      "caller": "cron",
      "allowedMethods": [
        "POST",
        "OPTIONS"
      ],
      "authMode": "cron_secret_plus_jwt",
      "allowedStaffRoles": [],
      "clientScope": "derived",
      "jwtVerification": "verified",
      "alternateSecret": "CRON_SECRET",
      "serviceRoleUsage": true,
      "deployable": true,
      "operationalOwner": "Cockpit engineering",
      "requiredEnvironment": [
        "SUPABASE_URL",
        "SUPABASE_SERVICE_ROLE_KEY",
        "CRON_SECRET"
      ]
    },
    "retired": {
      "lifecycle": "retired",
      "caller": "none",
      "allowedMethods": [],
      "authMode": "not_applicable",
      "allowedStaffRoles": [],
      "clientScope": "not_applicable",
      "jwtVerification": "not_deployable",
      "alternateSecret": null,
      "serviceRoleUsage": true,
      "deployable": false,
      "operationalOwner": "Cockpit engineering",
      "requiredEnvironment": []
    },
    "webhook_meta_verified": {
      "lifecycle": "active",
      "caller": "webhook",
      "allowedMethods": [
        "GET",
        "POST",
        "OPTIONS"
      ],
      "authMode": "webhook_signature",
      "allowedStaffRoles": [],
      "clientScope": "not_applicable",
      "jwtVerification": "disabled_with_alternate_auth",
      "alternateSecret": "META_APP_SECRET",
      "serviceRoleUsage": true,
      "deployable": true,
      "operationalOwner": "Cockpit engineering",
      "requiredEnvironment": [
        "SUPABASE_URL",
        "SUPABASE_SERVICE_ROLE_KEY",
        "AA_META_VERIFY_TOKEN",
        "META_APP_SECRET"
      ]
    },
    "ui_cross_business": {
      "lifecycle": "active",
      "caller": "ui",
      "allowedMethods": [
        "POST",
        "OPTIONS"
      ],
      "authMode": "staff_jwt",
      "allowedStaffRoles": [
        "admin",
        "account_manager",
        "strategist",
        "content_operator",
        "editor",
        "media_buyer",
        "analyst"
      ],
      "clientScope": "not_applicable",
      "jwtVerification": "verified",
      "alternateSecret": null,
      "serviceRoleUsage": true,
      "deployable": true,
      "operationalOwner": "Cockpit engineering",
      "requiredEnvironment": [
        "SUPABASE_URL",
        "SUPABASE_SERVICE_ROLE_KEY"
      ]
    }
  },
  "exceptions": [
    {
      "id": "EF-WORKER-003-JWT-CONFIG",
      "function": "process-asset-generation-jobs",
      "check": "jwt_config_mismatch",
      "owner": "Cockpit engineering",
      "reason": "Audit evidence records JWT-disabled remote worker posture, while local supabase/config.toml does not yet version it. Step 7 owns reconciliation; Step 2 must not change deployment configuration.",
      "reviewBy": "2026-09-30",
      "remediationIds": [
        "EF-WORKER-003"
      ]
    }
  ],
  "functions": [
    {
      "name": "apify-scrape",
      "purpose": "Preserve the retired legacy apify scrape endpoint for historical reference only; it has no current product role.",
      "system": "Retired Legacy",
      "page": "No active UI page",
      "profile": "retired",
      "databaseDomains": [
        "legacy"
      ],
      "storageBuckets": [],
      "externalProviders": [
        "apify"
      ],
      "requiredEnvironment": [
        "AA_APIFY_ACTOR"
      ],
      "auditPhases": [
        8,
        10
      ],
      "remediationIds": [
        "EF-RETIRE-001",
        "EF-RETIRE-002"
      ],
      "testCoverage": [
        "tests/stage-a-readiness.test.ts"
      ],
      "internalCallers": []
    },
    {
      "name": "approve-execution-config",
      "purpose": "Perform the existing approve execution config operation for the Context and Execution system without expanding its product responsibility.",
      "system": "Context and Execution",
      "page": "Context / Execution Setup",
      "profile": "ui_authority",
      "databaseDomains": [
        "context",
        "execution"
      ],
      "storageBuckets": [],
      "externalProviders": [],
      "requiredEnvironment": [],
      "auditPhases": [
        1,
        10
      ],
      "remediationIds": [],
      "testCoverage": [
        "tests/phase1-intelligence.test.ts",
        "tests/execution-config.test.ts"
      ],
      "internalCallers": []
    },
    {
      "name": "attach-asset-to-ad-creative",
      "purpose": "Finds-or-creates the Ad Opportunity + Ad Brief for an approved ads_master-origin asset's Calendar ref, then attaches the asset as a real image ad_creative_variants row -- the paid-content counterpart to promoteAssetGroupToDistribution's organic path.",
      "system": "Distribution and Paid",
      "page": "Creation / Assets",
      "profile": "ui_authority",
      "databaseDomains": [
        "production",
        "assets",
        "paid"
      ],
      "storageBuckets": [],
      "externalProviders": [],
      "requiredEnvironment": [],
      "auditPhases": [
        7,
        10
      ],
      "remediationIds": [],
      "testCoverage": [],
      "internalCallers": []
    },
    {
      "name": "brief-generator",
      "purpose": "Preserve the retired legacy brief generator endpoint for historical reference only; it has no current product role.",
      "system": "Retired Legacy",
      "page": "No active UI page",
      "profile": "retired",
      "databaseDomains": [
        "legacy"
      ],
      "storageBuckets": [],
      "externalProviders": [],
      "requiredEnvironment": [
        "ANTHROPIC_API_KEY"
      ],
      "auditPhases": [
        8,
        10
      ],
      "remediationIds": [
        "EF-RETIRE-001",
        "EF-RETIRE-002"
      ],
      "testCoverage": [
        "tests/stage-a-readiness.test.ts"
      ],
      "internalCallers": []
    },
    {
      "name": "check-ai-background-image",
      "purpose": "Perform the existing check ai background image operation for the Creation system without expanding its product responsibility.",